[
  {
    "source": "ÖBB",
    "category": "Störung",
    "title": "Deutsch Wagram und Gänserndorf",
    "description": "17.10.2025\nWegen einer Weichenstörung waren zwischen Deutsch Wagram Bahnhof und Gänserndorf Bahnhof bis 20:06 Uhr nur eingeschränkt Fahrten möglich.\nPlanen Sie derzeit noch bis zu 5 Minuten mehr Reisezeit ein.\nWir bitten um Entschuldigung.",
    "link": "https://fahrplan.oebb.at/bin/help.exe/dn?L=vs_scotty&tpl=showmap_external&",
    "guid": "https://fahrplan.oebb.at/bin/query.exe/dn?ujm=1&mapType=TRACKINFO&825024",
    "pubDate": "2025-10-17T20:14:59+02:00",
    "starts_at": "2025-10-17T20:14:59+02:00",
    "ends_at": null,
    "_identity": "oebb|https://fahrplan.oebb.at/bin/query.exe/dn?ujm=1&mapType=TRACKINFO&825024"
  },
  {
    "source": "ÖBB",
    "category": "Störung",
    "title": "Wien Nußdorf",
    "description": "31.10.2025 - 17.11.2025\nWegen Bauarbeiten können\nin Wien Nußdorf Bahnhst\nvon 31.10.2025 (22:00 Uhr) bis 03.11.2025 (02:00 Uhr) und\nvon 14.11.2025 (22:00 Uhr) bis 17.11.2025 (02:00 Uhr)\nkeine S40-Züge halten.\nFahrgäste mit gültigem Ticket haben die Möglichkeit Alternativverbindungen der Wiener Linien/VOR zu nutzen:\nTram D: Wien Franz-Josefs-Bahnhof <=> Nußdorf\nN36: Nußdorfer Straße <=> Nußdorf\nVOR-Buslinie 400: Wien Heiligenstadt <=> Klosterneuburg-Kierling Bahnhof\nWir bitten um Entschuldigung.\nDetails finden Sie hier...",
    "link": "https://fahrplan.oebb.at/bin/help.exe/dn?L=vs_scotty&tpl=showmap_external&",
    "guid": "https://fahrplan.oebb.at/bin/query.exe/dn?ujm=1&mapType=TRACKINFO&813955",
    "pubDate": "2025-10-08T09:36:01+02:00",
    "starts_at": "2025-10-08T09:36:01+02:00",
    "ends_at": null,
    "_identity": "oebb|https://fahrplan.oebb.at/bin/query.exe/dn?ujm=1&mapType=TRACKINFO&813955"
  }
]